{
  "book": "Exodus",
  "testament": "Old",
  "chapter": 21,
  "id": "exo-021-028-goring-ox",
  "title": "The Goring Ox: Stone the Ox, Owner Quit",
  "citation": "Exodus 21:28,31",
  "verses": "28,31",
  "categories": [
    "Civil",
    "Property",
    "Judicial"
  ],
  "law_type": "statute",
  "kjv_text": "If an ox gore a man or a woman, that they die: then the ox shall be surely stoned, and his flesh shall not be eaten; but the owner of the ox shall be quit... Whether he have gored a son, or have gored a daughter, according to this judgment shall it be done unto him.",
  "summary": "An ox that kills a person is stoned and its meat is taboo; the owner of a first-offense ox bears no liability. The rule applies equally when the victim is a child.",
  "original_audience": "Israelite livestock owners; the ox is the tractor, truck, and 401(k) of the household.",
  "immediate_context": "Opens the famous goring-ox series (vv.28-32), the comparative-law showpiece of the chapter.",
  "historical_context": "Laws of Eshnunna 53-55 and Hammurabi 250-252 handle the same ox with fines only; Israel alone executes the animal and bans its meat — the ox has shed human blood (Gen 9:5 holds beasts accountable) and is contaminated by it. Legal historians live on this pericope: it shows liability, foreseeability, and even animal culpability emerging in one barnyard.",
  "penalty": "Stoning of the ox; flesh unusable; owner exempt (first offense).",
  "exceptions": "A known goring ox changes everything (v.29); slave victims convert to a fixed fee (v.32).",
  "cross_references": [
    "Genesis 9:5",
    "Exodus 21:29-32",
    "Laws of Eshnunna 53-55 (comparative)"
  ],
  "nt_passages": [
    "1 Corinthians 9:9 / 1 Timothy 5:18 — 'thou shalt not muzzle the ox': Paul's ox-law hermeneutics, allegorizing barnyard statutes for clergy pay"
  ],
  "internal_contradictions": [],
  "sab_categories": [
    "Absurdity",
    "Cruelty and Violence"
  ],
  "usofc_implementation": "Extended by regulation to 'any instrumentality of death' — the Instrumentality Destruction Rule: the car, the gun, the robot arm that kills is ceremonially destroyed ('stoned') and cannot be salvaged or resold. Auto manufacturers lobbied for a firmware exception and lost, publicly, once — the regime's proudest consumer-protection story.",
  "agency": "Restitution Administration (RA)",
  "constitutional_analogue": "Civil asset forfeiture inverted (deodand revival — English law's forfeiture of death-causing objects, abolished 1846, resurrected here).",
  "scene_ideas": [
    "A public 'stoning' of a self-driving car in a courthouse lot, the crowd solemn, the manufacturer's lawyers filming for appeal.",
    "An RA evidence yard of contaminated instruments no one may touch, guarded like a reliquary in reverse."
  ],
  "satirical_uses": [
    "Firearms were ruled 'inert absent intent' and exempted; escalators were not, after the Cleveland incident."
  ],
  "bureaucratic_uses": [
    "Instrumentality destruction orders",
    "Contaminated-property registries"
  ],
  "confidence": "high"
}
