{
  "book": "Exodus",
  "testament": "Old",
  "chapter": 21,
  "id": "exo-021-002-hebrew-servant-six-years",
  "title": "Hebrew Servant Freed in the Seventh Year",
  "citation": "Exodus 21:2-3",
  "verses": "2-3",
  "categories": [
    "Civil",
    "Economic",
    "Family"
  ],
  "law_type": "statute",
  "kjv_text": "If thou buy an Hebrew servant, six years he shall serve: and in the seventh he shall go out free for nothing. If he came in by himself, he shall go out by himself: if he were married, then his wife shall go out with him.",
  "summary": "Debt servitude of a Hebrew man is capped at six years; in the seventh he goes free without payment, with the wife he brought in.",
  "original_audience": "Israelite creditors and debtors; servitude was the bankruptcy system of subsistence agriculture.",
  "immediate_context": "The Covenant Code's very first statute — the ex-slave nation legislates slavery before anything else, which is either irony or trauma.",
  "historical_context": "Hammurabi 117 releases the debt-slave after three years; the biblical term doubles it. Deut 15:12-15 adds mandatory severance gifts; Jer 34 shows the release being flouted and re-imposed. This applies to Hebrew men only — Lev 25:44-46 permits permanent chattel slavery of foreigners, the distinction on which every later pro-slavery sermon leaned.",
  "penalty": "None stated for violation; Jeremiah 34:17 has God sentence release-violators to 'liberty... to the sword.'",
  "exceptions": "The servant may elect permanent service (vv.5-6); female servants sold by fathers follow different rules (vv.7-11); foreigners are excluded from release entirely (Lev 25:44-46).",
  "cross_references": [
    "Deuteronomy 15:12-18",
    "Leviticus 25:39-46",
    "Jeremiah 34:8-22",
    "Genesis 29 (Jacob's seven-year terms)"
  ],
  "nt_passages": [
    "Luke 4:18 — Jesus announces 'deliverance to the captives' via Isaiah's jubilee language",
    "1 Corinthians 7:21-23 — 'if thou mayest be made free, use it rather'",
    "Philemon — Paul returns a runaway slave with a request, not an emancipation",
    "Ephesians 6:5 — 'servants, be obedient to them that are your masters', the regime's favorite"
  ],
  "internal_contradictions": [
    {
      "sab_id": "con42",
      "issue": "Does God approve of slavery? Regulated here and permitted permanently for foreigners (Lev 25:44-46), vs. 'ye were strangers in Egypt' ethics and Exodus's own liberation narrative.",
      "refs": [
        "Leviticus 25:44-46",
        "Exodus 22:21",
        "Deuteronomy 23:15-16"
      ]
    }
  ],
  "sab_categories": [
    "Family Values",
    "Injustice"
  ],
  "usofc_implementation": "Title V's foundation: Covenant Labor. Judgment debtors and the insolvent enter six-year labor bonds administered by the OSO; the seventh-year release is real and audited, which the regime advertises relentlessly as proof of mercy. The Lev 25 foreigner exception is 'held in abeyance' — officially. Guest-worker visa terms run six years and eleven months.",
  "agency": "Office of Servitude Oversight (OSO)",
  "constitutional_analogue": "The Thirteenth Amendment's punishment-clause exception, industrialized; six-year cap as the sole improvement on the American prison-labor status quo.",
  "scene_ideas": [
    "A release-day ceremony, brass band and cameras, while the freed man signs a 'voluntary' re-entry bond in the parking lot.",
    "An OSO auditor who genuinely believes in the seventh year, discovering the visa-term workaround.",
    "A Jeremiah 34 sermon preached at a labor camp chapel, to the guards' slow realization."
  ],
  "satirical_uses": [
    "The state's anti-slavery museum and its Covenant Labor intake office share a building; the museum is better funded."
  ],
  "bureaucratic_uses": [
    "Labor bond origination (Form S-1) with six-year amortization",
    "Seventh-Year Release audits",
    "Spousal accompaniment riders"
  ],
  "confidence": "high"
}
