{
  "id": "lev-002-011-no-leaven-no-honey",
  "title": "No Leaven, No Honey, No Sourdough Starter in the Offering",
  "citation": "Leviticus 2:11",
  "book": "Leviticus",
  "chapter": 2,
  "verses": "11",
  "testament": "Old",
  "categories": ["Ceremonial", "Dietary", "Religious"],
  "law_type": "prohibition",
  "kjv_text": "No meat offering, which ye shall bring unto the LORD, shall be made with leaven: for ye shall burn no leaven, nor any honey, in any offering of the LORD made by fire.",
  "summary": "Grain offerings burned on the altar may never contain leaven (a fermenting agent) or honey — both substances that ferment, swell, or otherwise change the offering from its raw, plain state — even though both were staples of the ordinary Israelite diet outside the altar.",
  "original_audience": "Israelite priests and worshippers bringing grain offerings (minchah) to the altar under the Levitical sacrificial system.",
  "immediate_context": "Opens the meat/grain-offering instructions of Leviticus 2, which otherwise specify fine flour, oil, and frankincense; this verse is the offering's one hard exclusion, paired two verses later with the mandatory addition of salt (2:13) — everything that ferments or sweetens is out, everything that preserves is required.",
  "historical_context": "Leaven's ordinary domestic use (bread-making) is precisely why it is barred from the altar: a substance that visibly grows, bubbles, and multiplies through fermentation reads in Israelite thought as change, corruption, or spreading impurity — the same logic behind purging leaven at Passover (Ex 12:15). Honey is banned alongside it not because it ferments identically, but because it too was a sweetening, non-plain domestic staple foreign to the altar's requirement of unadulterated grain; some ancient Near Eastern cultic texts similarly exclude honey from fire-offerings. Together the pair reads as a single principle: nothing brought to God may be a processed or 'improved' version of the raw grain He is owed.",
  "penalty": "None stated for this clause specifically; the wider sacrificial system treats an improperly prepared offering as unacceptable, void, or an occasion for priestly correction rather than personal punishment.",
  "exceptions": "Leavened bread is separately required, not forbidden, at Pentecost/Firstfruits (Lev 23:17) — offered as a wave offering, never burned on the altar — the Torah's own internal signal that the ban is about what touches the fire, not leaven as such.",
  "cross_references": ["Exodus 12:15", "Exodus 23:18", "Leviticus 6:17", "Leviticus 23:17", "Leviticus 2:13"],
  "nt_passages": ["1 Corinthians 5:6-8 — Paul allegorizes leaven as 'malice and wickedness,' urging the church to keep the feast 'with the unleavened bread of sincerity and truth'", "Matthew 16:6 — Jesus warns the disciples to 'beware of the leaven of the Pharisees,' reading leaven as corrupting doctrine"],
  "internal_contradictions": [
    {"issue": "The same corpus that bans leaven from the altar (2:11) separately commands leavened loaves as a mandatory Firstfruits offering (23:17) — the text distinguishes 'burned on the altar' from 'waved before the LORD' precisely so it is not self-contradictory, a distinction a modern bureaucracy administering both verses as absolute rules tends to flatten.", "refs": ["Leviticus 23:17"]}
  ],
  "sab_categories": ["Cruel and Unusual Punishments", "Dietary Laws"],
  "usofc_implementation": "The statutory root of the Bread Laws' harshest sub-rule, administered by the Bread and Devotion Bureau (BDB) as a blanket household prohibition rather than an altar-specific one: honey, herbs, and sourdough starters are banned from any bread baked in a citizen's home during the Holy Week fasting cycle, on the theory that a home hearth during a consecrated season is itself a kind of altar. Households are required to bake exclusively with government-issued, pre-measured flour during these cycles — a starter culture kept alive in a family kitchen (a living, fermenting thing, precisely leaven's ancient offense) is treated as contraband and, if discovered, as prima facie evidence of a household maintaining forbidden `sourdough` continuity across fasting cycles, i.e. of never actually purging the leaven the Passover-analogue statute (`exo-012-015-purge-the-leaven`) requires. This is the mechanism that makes Constance's cookie recipe — built on her own starter and sweetened with honey — doubly contraband in Mark's Year 10 climax, independent of the timing violation alone.",
  "agency": "Bread and Devotion Bureau (BDB)",
  "constitutional_analogue": "A modern home-inspection or food-safety regulatory regime, repurposed from consumer protection into religious surveillance of a household's kitchen as a devotional space.",
  "scene_ideas": [
    "A BDB inspector distinguishing, with total sincerity, between the household's confiscated honey jar (contraband) and the sugar bowl beside it (permitted), unable to articulate why beyond 'it's in the statute.'",
    "A black market in starter cultures, passed between women like folk medicine, each jar a small act of memory and defiance."
  ],
  "satirical_uses": ["A verse about altar offerings, addressed to priests handling sacrificial grain, repurposed into a surveillance rule about ordinary family kitchens."],
  "bureaucratic_uses": ["Government-Issued Flour Allocation (Holy Week cycles)", "Starter Culture Contraband Determination", "BDB Form 2-11: Household Leaven & Honey Declaration"],
  "confidence": "medium"
}
