{
  "book": "Exodus",
  "testament": "Old",
  "chapter": 21,
  "id": "exo-021-004-masters-wife-and-children",
  "title": "Master Keeps the Wife He Gave, and Her Children",
  "citation": "Exodus 21:4",
  "verses": "4",
  "categories": [
    "Civil",
    "Family",
    "Property"
  ],
  "law_type": "statute",
  "kjv_text": "If his master have given him a wife, and she have born him sons or daughters; the wife and her children shall be her master's, and he shall go out by himself.",
  "summary": "If the master supplied the servant's wife, she and their children remain the master's property at release; the man goes free alone.",
  "original_audience": "Israelite slaveholders; the wife in view is the master's servant, whose status transfers to her children.",
  "immediate_context": "Qualifies the six-year release (v.2) and manufactures the dilemma that v.5-6's perpetual-service election 'solves.'",
  "historical_context": "Standard ANE property logic — offspring follow the mother's status — but here it functions as a retention mechanism: the family is the leverage that converts a six-year term into voluntary perpetuity. The law's cold machinery is visible in a way later apologetics never quite survives.",
  "penalty": "None; this is an allocation rule.",
  "exceptions": "None stated.",
  "cross_references": [
    "Exodus 21:2-6",
    "Leviticus 25:41 (in jubilee release, children go out with the father)",
    "Genesis 30-31 (Laban retaining Jacob's family as leverage)"
  ],
  "nt_passages": [
    "Galatians 4:22-31 — Paul allegorizes slave-born vs. free-born children",
    "Philemon 12 — Paul sends Onesimus back 'as mine own bowels'"
  ],
  "internal_contradictions": [
    {
      "sab_id": "con42",
      "issue": "Does God approve of slavery? This verse makes wives and children retention collateral.",
      "refs": [
        "Leviticus 25:41"
      ]
    },
    {
      "issue": "Leviticus 25:41 releases the servant's children with him at jubilee; this statute keeps them — two codes, two answers.",
      "refs": [
        "Leviticus 25:41"
      ]
    }
  ],
  "sab_categories": [
    "Family Values",
    "Injustice"
  ],
  "usofc_implementation": "In Covenant Labor regulations: dependents 'provisioned by the bondholder' (company housing, company school) remain bond-attached when the laborer's term ends. Families literally weigh release against separation. The OSO calls the retention file a Household Continuity Plan.",
  "agency": "Office of Servitude Oversight (OSO)",
  "constitutional_analogue": "Anti-peonage law (42 U.S.C. §1994) exists to prohibit exactly this; the USofC repealed it citing this verse.",
  "scene_ideas": [
    "A release hearing where the OSO clerk slides the Household Continuity Plan across the table and waits.",
    "Children raised in bond housing doing the math on their own status at age ten.",
    "An underground 'Leviticus 25:41 network' that smuggles whole families out on a rival proof-text."
  ],
  "satirical_uses": [
    "The regime's family-values ministry and its family-retention statute are administered from the same floor."
  ],
  "bureaucratic_uses": [
    "Household Continuity Plans",
    "Dependent status determination worksheets"
  ],
  "confidence": "high"
}
