{
  "book": "Exodus",
  "testament": "Old",
  "chapter": 21,
  "id": "exo-021-013-refuge-for-manslaughter",
  "title": "A Place to Flee for the Unintentional Killer",
  "citation": "Exodus 21:13",
  "verses": "13",
  "categories": [
    "Judicial",
    "Civil"
  ],
  "law_type": "statute",
  "kjv_text": "And if a man lie not in wait, but God deliver him into his hand; then I will appoint thee a place whither he shall flee.",
  "summary": "Killing without premeditation ('God delivered him into his hand') is not capital; the killer flees to an appointed place of asylum.",
  "original_audience": "Israelites navigating blood-vengeance culture: the avenger of blood was entitled to kill the killer unless asylum intervened.",
  "immediate_context": "First intent-distinction in biblical law, grading v.12's absolute; Numbers 35 builds it into the six Cities of Refuge.",
  "historical_context": "Asylum at altars was pan-Mediterranean; Israel institutionalizes it into designated cities with residency terms (until the high priest's death, Num 35:25 — history's strangest parole clock). The 'God delivered him' idiom makes accident a species of providence: the manslayer is God's instrument, hence protected.",
  "penalty": "Exile to refuge in lieu of death; leaving early forfeits protection (Num 35:26-28).",
  "exceptions": "Premeditation voids asylum (v.14).",
  "cross_references": [
    "Numbers 35:9-34",
    "Deuteronomy 19:1-10",
    "Joshua 20",
    "1 Kings 1:50-53 (altar asylum attempted)"
  ],
  "nt_passages": [
    "Hebrews 6:18 — 'fled for refuge' as salvation metaphor, the institution spiritualized"
  ],
  "internal_contradictions": [
    {
      "issue": "'God deliver him into his hand' makes the deity the proximate cause of accidents — a determinism the courts must administer without examining.",
      "refs": [
        "Numbers 35:22-25"
      ]
    }
  ],
  "sab_categories": [],
  "usofc_implementation": "The six federal Cities of Refuge, restored by statute: manslaughter defendants may physically outrun prosecution to a Refuge City and remain until the sitting Chief Overseer dies. The cities have become pressure-cooker municipalities of the almost-guilty — part sanctuary, part open-air prison, wholly surveilled, economically booming.",
  "agency": "Covenant Courts",
  "constitutional_analogue": "Sanctuary jurisdictions plus parole, keyed to an official's lifespan — a due-process fever dream.",
  "scene_ideas": [
    "The Refuge City betting markets on the Chief Overseer's health, run openly out of barbershops.",
    "An avenger of blood (a licensed status) waiting at the city limits, legally, for one man, for eleven years.",
    "A refuge resident who was actually innocent, now unable to prove it without leaving the walls to be killed."
  ],
  "satirical_uses": [
    "The Chief Overseer's annual physical is a national market event; his cardiologist requires a security detail."
  ],
  "bureaucratic_uses": [
    "Refuge residency permits keyed to the Overseer's tenure",
    "Avenger-of-blood licensing (Form AV-1)",
    "City-limits geofencing compliance"
  ],
  "confidence": "high"
}
